{
  "schema_version": "1.0",
  "run_id": "run-sample-forced-abort",
  "experiment_id": "restart-things-search-sample",
  "status": "aborted",
  "created_at": "2026-10-10T12:10:00Z",
  "prediction": { "predicted_slis": { "write": "hold", "search": "fail", "freshness": "hold" } },
  "observations": [
    { "kind": "sli", "sli": "search", "window": "during", "error_rate": 1.0, "p95_ms": 3000.0 },
    { "kind": "kill_switch", "tripped": true, "forced_test": true, "reason": "threshold deliberately set low" },
    { "kind": "recovery", "recovery_s": 12.0, "recovered": true }
  ],
  "cleanup_state": "complete",
  "safety_violation": false
}
