{
  "schema_version": "1.0",
  "run_id": "run-sample-normal",
  "experiment_id": "restart-things-search-sample",
  "status": "completed",
  "created_at": "2026-10-10T12:00:00Z",
  "prediction": { "predicted_slis": { "write": "hold", "search": "fail", "freshness": "hold" } },
  "observations": [
    { "kind": "sli", "sli": "write", "window": "during", "error_rate": 0.0, "p95_ms": 36.0 },
    { "kind": "sli", "sli": "search", "window": "during", "error_rate": 1.0, "p95_ms": 3000.0 },
    { "kind": "sli", "sli": "freshness", "window": "during", "error_rate": 0.0, "p95_ms": 41.0 },
    { "kind": "recovery", "recovery_s": 38.0, "recovered": true }
  ],
  "cleanup_state": "complete",
  "safety_violation": false
}
